{
 "meta": {
  "schema_version": 3,
  "scanner_version": "guide",
  "repo": "shared",
  "root": null,
  "commit": "0000000000000000000000000000000000000001",
  "scanned_at": "2026-10-08T00:00:00Z",
  "languages": [
   "python"
  ],
  "domain_context": null
 },
 "nodes": [
  {
   "id": "lib:common",
   "kind": "library",
   "name": "common",
   "modules": [
    "common"
   ]
  },
  {
   "id": "svc:orders",
   "kind": "service",
   "name": "orders",
   "modules": [
    "orders"
   ],
   "evidence": [
    {
     "file": "compose.yaml",
     "line": 2
    }
   ]
  },
  {
   "id": "orders::api/",
   "kind": "package",
   "parent": "svc:orders",
   "name": "api",
   "lang": "python",
   "file": "orders/api",
   "line": 1,
   "visibility": "public",
   "metrics": {},
   "role": "entry"
  },
  {
   "id": "orders::api.routes",
   "kind": "file",
   "parent": "orders::api/",
   "name": "routes.py",
   "lang": "python",
   "file": "orders/api/routes.py",
   "line": 1,
   "visibility": "public",
   "metrics": {
    "loc": 20
   }
  },
  {
   "id": "orders::api.routes#place_order/1",
   "kind": "method",
   "parent": "orders::api.routes",
   "name": "place_order",
   "lang": "python",
   "file": "orders/api/routes.py",
   "line": 2,
   "visibility": "public",
   "metrics": {
    "loc": 6
   },
   "signature": {
    "params": [
     {
      "name": "body",
      "type": "dict"
     }
    ],
    "returns": "dict"
   }
  },
  {
   "id": "orders::store/",
   "kind": "package",
   "parent": "svc:orders",
   "name": "store",
   "lang": "python",
   "file": "orders/store",
   "line": 1,
   "visibility": "public",
   "metrics": {},
   "role": "storage"
  },
  {
   "id": "orders::store.repo",
   "kind": "file",
   "parent": "orders::store/",
   "name": "repo.py",
   "lang": "python",
   "file": "orders/store/repo.py",
   "line": 1,
   "visibility": "public",
   "metrics": {
    "loc": 20
   }
  },
  {
   "id": "orders::store.repo.OrderStore",
   "kind": "class",
   "parent": "orders::store.repo",
   "name": "OrderStore",
   "lang": "python",
   "file": "orders/store/repo.py",
   "line": 2,
   "visibility": "public",
   "metrics": {
    "loc": 10
   }
  },
  {
   "id": "orders::store.repo.OrderStore#save/1",
   "kind": "method",
   "parent": "orders::store.repo.OrderStore",
   "name": "save",
   "lang": "python",
   "file": "orders/store/repo.py",
   "line": 4,
   "visibility": "public",
   "metrics": {
    "loc": 6
   },
   "signature": {
    "params": [
     {
      "name": "order",
      "type": "dict"
     }
    ],
    "returns": "None"
   }
  },
  {
   "id": "orders::store.repo.SqlOrderStore",
   "kind": "class",
   "parent": "orders::store.repo",
   "name": "SqlOrderStore",
   "lang": "python",
   "file": "orders/store/repo.py",
   "line": 6,
   "visibility": "public",
   "metrics": {
    "loc": 10
   },
   "implements": [
    "orders::store.repo.OrderStore"
   ]
  },
  {
   "id": "orders::store.repo.SqlOrderStore#save/1",
   "kind": "method",
   "parent": "orders::store.repo.SqlOrderStore",
   "name": "save",
   "lang": "python",
   "file": "orders/store/repo.py",
   "line": 8,
   "visibility": "public",
   "metrics": {
    "loc": 6
   },
   "signature": {
    "params": [
     {
      "name": "order",
      "type": "dict"
     }
    ],
    "returns": "None"
   }
  },
  {
   "id": "common::common/",
   "kind": "package",
   "parent": "lib:common",
   "name": "common",
   "lang": "python",
   "file": "common/common",
   "line": 1,
   "visibility": "public",
   "metrics": {},
   "role": "logic"
  },
  {
   "id": "common::common.retry",
   "kind": "file",
   "parent": "common::common/",
   "name": "retry.py",
   "lang": "python",
   "file": "common/common/retry.py",
   "line": 1,
   "visibility": "public",
   "metrics": {
    "loc": 20
   }
  },
  {
   "id": "common::common.retry#with_retry/1",
   "kind": "method",
   "parent": "common::common.retry",
   "name": "with_retry",
   "lang": "python",
   "file": "common/common/retry.py",
   "line": 2,
   "visibility": "public",
   "metrics": {
    "loc": 6
   },
   "signature": {
    "params": [
     {
      "name": "fn",
      "type": "Callable"
     }
    ],
    "returns": "Any"
   }
  }
 ],
 "relations": [
  {
   "id": "r:calls:orders::api.routes#place_order/1->orders::store.repo.OrderStore#save/1:",
   "kind": "calls",
   "from": "orders::api.routes#place_order/1",
   "to": "orders::store.repo.OrderStore#save/1",
   "key": null,
   "confidence": "confirmed",
   "evidence": [
    {
     "file": "orders/api/routes.py",
     "line": 4
    }
   ]
  },
  {
   "id": "r:calls:orders::store.repo.SqlOrderStore#save/1->common::common.retry#with_retry/1:",
   "kind": "calls",
   "from": "orders::store.repo.SqlOrderStore#save/1",
   "to": "common::common.retry#with_retry/1",
   "key": null,
   "confidence": "confirmed",
   "evidence": [
    {
     "file": "orders/store/repo.py",
     "line": 10
    }
   ]
  },
  {
   "id": "r:uses-code:svc:orders->lib:common:",
   "kind": "uses-code",
   "from": "svc:orders",
   "to": "lib:common",
   "key": null,
   "confidence": "confirmed",
   "evidence": [
    {
     "file": "orders/requirements.txt",
     "line": 1
    }
   ]
  }
 ],
 "pins": [],
 "unpinned": [],
 "examples": {
  "types": {},
  "entries": []
 },
 "files": {
  "orders/api/routes.py": {
   "lang": "python",
   "module": "mod:orders",
   "node": "orders::api.routes",
   "parse_error": false,
   "routes": [
    {
     "method": "POST",
     "path": "/v1/orders",
     "handler": "orders::api.routes#place_order/1",
     "line": 3
    }
   ]
  },
  "orders/store/repo.py": {
   "lang": "python",
   "module": "mod:orders",
   "node": "orders::store.repo",
   "parse_error": false
  },
  "common/common/retry.py": {
   "lang": "python",
   "module": "mod:common",
   "node": "common::common.retry",
   "parse_error": false
  }
 },
 "problems": [],
 "layout": {
  "version": 1,
  "containers": {
   "site": {
    "strategy": "main-bus",
    "items": {
     "svc:orders": {
      "region": "line",
      "col": 0,
      "row": 0
     },
     "lib:common": {
      "region": "shelf",
      "col": 0,
      "row": 0
     }
    },
    "lanes": [],
    "groups": [],
    "utilities": [],
    "hubs": []
   },
   "common::common.retry": {
    "strategy": "layered",
    "items": {
     "common::common.retry#with_retry/1": {
      "region": "line",
      "col": 0,
      "row": 0
     }
    },
    "lanes": [],
    "groups": [],
    "utilities": [],
    "hubs": []
   },
   "common::common/": {
    "strategy": "layered",
    "items": {
     "common::common.retry": {
      "region": "line",
      "col": 0,
      "row": 0
     }
    },
    "lanes": [],
    "groups": [],
    "utilities": [],
    "hubs": []
   },
   "lib:common": {
    "strategy": "bands",
    "items": {
     "common::common/": {
      "region": "line",
      "col": 1,
      "row": 0
     }
    },
    "lanes": [],
    "groups": [],
    "utilities": [],
    "hubs": []
   },
   "orders::api.routes": {
    "strategy": "layered",
    "items": {
     "orders::api.routes#place_order/1": {
      "region": "line",
      "col": 0,
      "row": 0
     }
    },
    "lanes": [],
    "groups": [],
    "utilities": [],
    "hubs": []
   },
   "orders::api/": {
    "strategy": "layered",
    "items": {
     "orders::api.routes": {
      "region": "line",
      "col": 0,
      "row": 0
     }
    },
    "lanes": [],
    "groups": [],
    "utilities": [],
    "hubs": []
   },
   "orders::store.repo": {
    "strategy": "layered",
    "items": {
     "orders::store.repo.OrderStore": {
      "region": "line",
      "col": 0,
      "row": 0
     },
     "orders::store.repo.SqlOrderStore": {
      "region": "line",
      "col": 0,
      "row": 1
     }
    },
    "lanes": [],
    "groups": [],
    "utilities": [],
    "hubs": []
   },
   "orders::store.repo.OrderStore": {
    "strategy": "layered",
    "items": {
     "orders::store.repo.OrderStore#save/1": {
      "region": "line",
      "col": 0,
      "row": 0
     }
    },
    "lanes": [],
    "groups": [],
    "utilities": [],
    "hubs": []
   },
   "orders::store.repo.SqlOrderStore": {
    "strategy": "layered",
    "items": {
     "orders::store.repo.SqlOrderStore#save/1": {
      "region": "line",
      "col": 0,
      "row": 0
     }
    },
    "lanes": [],
    "groups": [],
    "utilities": [],
    "hubs": []
   },
   "orders::store/": {
    "strategy": "layered",
    "items": {
     "orders::store.repo": {
      "region": "line",
      "col": 0,
      "row": 0
     }
    },
    "lanes": [],
    "groups": [],
    "utilities": [],
    "hubs": []
   },
   "svc:orders": {
    "strategy": "bands",
    "items": {
     "orders::store/": {
      "region": "bus",
      "col": 0,
      "row": 0
     },
     "orders::api/": {
      "region": "line",
      "col": 0,
      "row": 0
     }
    },
    "lanes": [],
    "groups": [],
    "utilities": [],
    "hubs": []
   }
  }
 }
}
