{
 "meta": {
  "schema_version": 3,
  "scanner_version": "guide",
  "repo": "queues",
  "root": null,
  "commit": "0000000000000000000000000000000000000001",
  "scanned_at": "2026-10-08T00:00:00Z",
  "languages": [
   "python"
  ],
  "domain_context": null
 },
 "nodes": [
  {
   "id": "svc:billing",
   "kind": "service",
   "name": "billing",
   "modules": [
    "billing"
   ],
   "evidence": [
    {
     "file": "compose.yaml",
     "line": 3
    }
   ]
  },
  {
   "id": "svc:orders",
   "kind": "service",
   "name": "orders",
   "modules": [
    "orders"
   ],
   "evidence": [
    {
     "file": "compose.yaml",
     "line": 2
    }
   ]
  },
  {
   "id": "svc:payments",
   "kind": "service",
   "name": "payments",
   "modules": [
    "payments"
   ],
   "evidence": [
    {
     "file": "compose.yaml",
     "line": 4
    }
   ]
  },
  {
   "id": "topic:events:invoices",
   "kind": "topic",
   "name": "invoices",
   "delivery": "queue",
   "evidence": [
    {
     "file": "deploy/queues.yaml",
     "line": 2
    }
   ]
  },
  {
   "id": "topic:events:invoices-dead",
   "kind": "topic",
   "name": "invoices-dead",
   "delivery": "queue",
   "dead_letter_of": "topic:events:invoices",
   "evidence": [
    {
     "file": "deploy/queues.yaml",
     "line": 6
    }
   ]
  },
  {
   "id": "orders::api/",
   "kind": "package",
   "parent": "svc:orders",
   "name": "api",
   "lang": "python",
   "file": "orders/api",
   "line": 1,
   "visibility": "public",
   "metrics": {},
   "role": "entry"
  },
  {
   "id": "orders::api.routes",
   "kind": "file",
   "parent": "orders::api/",
   "name": "routes.py",
   "lang": "python",
   "file": "orders/api/routes.py",
   "line": 1,
   "visibility": "public",
   "metrics": {
    "loc": 20
   }
  },
  {
   "id": "orders::api.routes#place_order/1",
   "kind": "method",
   "parent": "orders::api.routes",
   "name": "place_order",
   "lang": "python",
   "file": "orders/api/routes.py",
   "line": 2,
   "visibility": "public",
   "metrics": {
    "loc": 6
   },
   "signature": {
    "params": [
     {
      "name": "body",
      "type": "dict"
     }
    ],
    "returns": "dict"
   }
  },
  {
   "id": "billing::api/",
   "kind": "package",
   "parent": "svc:billing",
   "name": "api",
   "lang": "python",
   "file": "billing/api",
   "line": 1,
   "visibility": "public",
   "metrics": {},
   "role": "entry"
  },
  {
   "id": "billing::api.routes",
   "kind": "file",
   "parent": "billing::api/",
   "name": "routes.py",
   "lang": "python",
   "file": "billing/api/routes.py",
   "line": 1,
   "visibility": "public",
   "metrics": {
    "loc": 20
   }
  },
  {
   "id": "billing::api.routes#take/1",
   "kind": "method",
   "parent": "billing::api.routes",
   "name": "take",
   "lang": "python",
   "file": "billing/api/routes.py",
   "line": 2,
   "visibility": "public",
   "metrics": {
    "loc": 6
   },
   "signature": {
    "params": [
     {
      "name": "body",
      "type": "dict"
     }
    ],
    "returns": "dict"
   }
  },
  {
   "id": "payments::api/",
   "kind": "package",
   "parent": "svc:payments",
   "name": "api",
   "lang": "python",
   "file": "payments/api",
   "line": 1,
   "visibility": "public",
   "metrics": {},
   "role": "entry"
  },
  {
   "id": "payments::api.routes",
   "kind": "file",
   "parent": "payments::api/",
   "name": "routes.py",
   "lang": "python",
   "file": "payments/api/routes.py",
   "line": 1,
   "visibility": "public",
   "metrics": {
    "loc": 20
   }
  },
  {
   "id": "payments::api.routes#take/1",
   "kind": "method",
   "parent": "payments::api.routes",
   "name": "take",
   "lang": "python",
   "file": "payments/api/routes.py",
   "line": 2,
   "visibility": "public",
   "metrics": {
    "loc": 6
   },
   "signature": {
    "params": [
     {
      "name": "body",
      "type": "dict"
     }
    ],
    "returns": "dict"
   }
  }
 ],
 "relations": [
  {
   "kind": "event",
   "from": "billing::api.routes#take/1",
   "to": "topic:events:invoices-dead",
   "key": "invoices-dead",
   "confidence": "confirmed",
   "evidence": [
    {
     "file": "billing/api/routes.py",
     "line": 1
    }
   ],
   "on_failure": true,
   "id": "r:event:billing::api.routes#take/1->topic:events:invoices-dead:invoices-dead",
   "data": "forward"
  },
  {
   "kind": "event",
   "from": "orders::api.routes#place_order/1",
   "to": "topic:events:invoices",
   "key": "invoices",
   "confidence": "confirmed",
   "evidence": [
    {
     "file": "orders/api/routes.py",
     "line": 1
    }
   ],
   "id": "r:event:orders::api.routes#place_order/1->topic:events:invoices:invoices",
   "data": "forward"
  },
  {
   "kind": "event",
   "from": "topic:events:invoices",
   "to": "billing::api.routes#take/1",
   "key": "invoices",
   "confidence": "confirmed",
   "evidence": [
    {
     "file": "billing/api/routes.py",
     "line": 1
    }
   ],
   "id": "r:event:topic:events:invoices->billing::api.routes#take/1:invoices",
   "data": "forward"
  },
  {
   "kind": "event",
   "from": "topic:events:invoices",
   "to": "payments::api.routes#take/1",
   "key": "invoices",
   "confidence": "confirmed",
   "evidence": [
    {
     "file": "payments/api/routes.py",
     "line": 1
    }
   ],
   "id": "r:event:topic:events:invoices->payments::api.routes#take/1:invoices",
   "data": "forward"
  }
 ],
 "pins": [],
 "unpinned": [],
 "examples": {
  "types": {},
  "entries": []
 },
 "files": {
  "orders/api/routes.py": {
   "lang": "python",
   "module": "mod:orders",
   "node": "orders::api.routes",
   "parse_error": false,
   "routes": [
    {
     "method": "POST",
     "path": "/v1/run",
     "handler": "orders::api.routes#place_order/1",
     "line": 3
    }
   ]
  },
  "billing/api/routes.py": {
   "lang": "python",
   "module": "mod:billing",
   "node": "billing::api.routes",
   "parse_error": false,
   "routes": [
    {
     "method": "POST",
     "path": "/v1/run",
     "handler": "billing::api.routes#take/1",
     "line": 3
    }
   ]
  },
  "payments/api/routes.py": {
   "lang": "python",
   "module": "mod:payments",
   "node": "payments::api.routes",
   "parse_error": false,
   "routes": [
    {
     "method": "POST",
     "path": "/v1/run",
     "handler": "payments::api.routes#take/1",
     "line": 3
    }
   ]
  }
 },
 "problems": [],
 "layout": {
  "version": 1,
  "containers": {
   "site": {
    "strategy": "main-bus",
    "items": {
     "topic:events:invoices": {
      "region": "bus",
      "col": 1,
      "row": 0
     },
     "topic:events:invoices-dead": {
      "region": "bus",
      "col": 2,
      "row": 0
     },
     "svc:orders": {
      "region": "line",
      "col": 0,
      "row": 0
     },
     "svc:billing": {
      "region": "line",
      "col": 1,
      "row": 0
     },
     "svc:payments": {
      "region": "line",
      "col": 1,
      "row": 1
     }
    },
    "lanes": [
     {
      "id": "broker:events",
      "row": 0
     }
    ],
    "groups": [],
    "utilities": [],
    "hubs": []
   },
   "billing::api.routes": {
    "strategy": "layered",
    "items": {
     "billing::api.routes#take/1": {
      "region": "line",
      "col": 0,
      "row": 0
     }
    },
    "lanes": [],
    "groups": [],
    "utilities": [],
    "hubs": []
   },
   "billing::api/": {
    "strategy": "layered",
    "items": {
     "billing::api.routes": {
      "region": "line",
      "col": 0,
      "row": 0
     }
    },
    "lanes": [],
    "groups": [],
    "utilities": [],
    "hubs": []
   },
   "orders::api.routes": {
    "strategy": "layered",
    "items": {
     "orders::api.routes#place_order/1": {
      "region": "line",
      "col": 0,
      "row": 0
     }
    },
    "lanes": [],
    "groups": [],
    "utilities": [],
    "hubs": []
   },
   "orders::api/": {
    "strategy": "layered",
    "items": {
     "orders::api.routes": {
      "region": "line",
      "col": 0,
      "row": 0
     }
    },
    "lanes": [],
    "groups": [],
    "utilities": [],
    "hubs": []
   },
   "payments::api.routes": {
    "strategy": "layered",
    "items": {
     "payments::api.routes#take/1": {
      "region": "line",
      "col": 0,
      "row": 0
     }
    },
    "lanes": [],
    "groups": [],
    "utilities": [],
    "hubs": []
   },
   "payments::api/": {
    "strategy": "layered",
    "items": {
     "payments::api.routes": {
      "region": "line",
      "col": 0,
      "row": 0
     }
    },
    "lanes": [],
    "groups": [],
    "utilities": [],
    "hubs": []
   },
   "svc:billing": {
    "strategy": "bands",
    "items": {
     "billing::api/": {
      "region": "line",
      "col": 0,
      "row": 0
     }
    },
    "lanes": [],
    "groups": [],
    "utilities": [],
    "hubs": []
   },
   "svc:orders": {
    "strategy": "bands",
    "items": {
     "orders::api/": {
      "region": "line",
      "col": 0,
      "row": 0
     }
    },
    "lanes": [],
    "groups": [],
    "utilities": [],
    "hubs": []
   },
   "svc:payments": {
    "strategy": "bands",
    "items": {
     "payments::api/": {
      "region": "line",
      "col": 0,
      "row": 0
     }
    },
    "lanes": [],
    "groups": [],
    "utilities": [],
    "hubs": []
   }
  }
 }
}
